{
  "site": "http://127.0.0.1:45997",
  "audited_at": "2026-01-01T00:00:00Z",
  "summary": {
    "total_findings": 3,
    "critical": 0,
    "high": 1,
    "medium": 1,
    "low": 1,
    "discoverability": 1,
    "engagement": 2
  },
  "scope": {
    "pages_sampled": 4,
    "pages_readable": 4,
    "urls": [
      "http://127.0.0.1:45997/",
      "http://127.0.0.1:45997/articles/texas-battery-co-op-heat-dome.html",
      "http://127.0.0.1:45997/author/priya-chandran.html",
      "http://127.0.0.1:45997/index.html"
    ],
    "render_available": false,
    "robots_txt_found": true,
    "offline_replay": false,
    "skills_run": [
      "crawler-access",
      "machine-readability",
      "fact-extractability",
      "entity-trust",
      "onsite-engagement"
    ],
    "skill_errors": []
  },
  "limitations": [
    "Single-variant fetch: one geography, one device profile, no logged-in state, no cookie consent accepted. Personalization and geo/consent-gated content are not observed.",
    "Lab proxy, not field data: latency and Core Web Vitals appear as risk factors measured once, not real-user metrics.",
    "Network-dependent checks (sameAs resolvability, broken links) reflect what was reachable at audit time and are excluded from the byte-for-byte determinism guarantee."
  ],
  "findings": [
    {
      "id": "F-001",
      "title": "Organization node missing core identity fields",
      "severity": "high",
      "category": "org-entity-anchor-idgraph",
      "half": "discoverability",
      "evidence": "Organization JSON-LD missing name/url/logo on 3/4 pages; missing-field frequency: url (3). Example: http://127.0.0.1:45997/ Organization missing url.",
      "evidence_detail": {
        "missing_field_counts": {
          "name": 0,
          "url": 3,
          "logo": 0
        }
      },
      "mechanism": "Without name+url+logo the node cannot be matched to a knowledge-graph entity or rendered in a brand panel.",
      "suggested_action": {
        "summary": "Populate name, url and logo on the Organization node; foundingDate is optional.",
        "priority": "high",
        "mechanism": "Without name+url+logo the node cannot be matched to a knowledge-graph entity or rendered in a brand panel.",
        "effort": "low",
        "confidence": "high"
      }
    },
    {
      "id": "F-002",
      "title": "Images ship at one size and load eagerly below the fold",
      "severity": "medium",
      "category": "image-optimization-lazyload",
      "half": "engagement",
      "evidence": "3 below-fold content images missing loading=lazy across 3/4 pages. (Hero/first image intentionally excluded.)",
      "evidence_detail": {
        "unresponsive_pages": [],
        "nonlazy_pages": [
          "http://127.0.0.1:45997/",
          "http://127.0.0.1:45997/articles/texas-battery-co-op-heat-dome.html",
          "http://127.0.0.1:45997/index.html"
        ],
        "unresponsive_count": 0,
        "nonlazy_count": 3
      },
      "mechanism": "Oversized single-resolution images waste bandwidth and delay paint; eager below-fold images compete with above-fold content for the network.",
      "suggested_action": {
        "summary": "Add srcset/<picture> responsive variants to large images and loading=lazy to below-fold content images; leave the hero/LCP image eager.",
        "priority": "medium",
        "mechanism": "Oversized single-resolution images waste bandwidth and delay paint; eager below-fold images compete with above-fold content for the network.",
        "effort": "low",
        "confidence": "medium"
      }
    },
    {
      "id": "F-003",
      "title": "Missing landmarks, skip link, or a clear above-fold value proposition",
      "severity": "low",
      "category": "landmarks-skiplink-valueprop",
      "half": "engagement",
      "evidence": "no skip-to-content link on 4/4 pages. Heuristic; value-prop baked into a hero image is not detected.",
      "evidence_detail": {
        "no_main_pages": [],
        "no_skiplink_pages": [
          "http://127.0.0.1:45997/",
          "http://127.0.0.1:45997/articles/texas-battery-co-op-heat-dome.html",
          "http://127.0.0.1:45997/author/priya-chandran.html",
          "http://127.0.0.1:45997/index.html"
        ],
        "no_valueprop_pages": []
      },
      "mechanism": "Landmarks and skip links aid keyboard/screen-reader navigation; a clear above-fold value prop tells arrivals they're in the right place, reducing bounce.",
      "suggested_action": {
        "summary": "Wrap primary content in <main>, add a skip-to-content link, and lead with an H1 plus a one-line description of what the page offers.",
        "priority": "low",
        "mechanism": "Landmarks and skip links aid keyboard/screen-reader navigation; a clear above-fold value prop tells arrivals they're in the right place, reducing bounce.",
        "effort": "low",
        "confidence": "low"
      }
    }
  ]
}