{
  "site": "http://127.0.0.1:42695",
  "audited_at": "2026-01-01T00:00:00Z",
  "summary": {
    "total_findings": 3,
    "critical": 0,
    "high": 0,
    "medium": 1,
    "low": 2,
    "discoverability": 2,
    "engagement": 2
  },
  "scope": {
    "pages_sampled": 5,
    "pages_readable": 5,
    "urls": [
      "http://127.0.0.1:42695/",
      "http://127.0.0.1:42695/about.html",
      "http://127.0.0.1:42695/collections.html",
      "http://127.0.0.1:42695/index.html",
      "http://127.0.0.1:42695/product-scarf.html"
    ],
    "render_available": false,
    "robots_txt_found": true,
    "offline_replay": false,
    "skills_run": [
      "crawler-access",
      "machine-readability",
      "fact-extractability",
      "entity-trust",
      "onsite-engagement"
    ],
    "skill_errors": []
  },
  "limitations": [
    "Single-variant fetch: one geography, one device profile, no logged-in state, no cookie consent accepted. Personalization and geo/consent-gated content are not observed.",
    "Lab proxy, not field data: latency and Core Web Vitals appear as risk factors measured once, not real-user metrics.",
    "Network-dependent checks (sameAs resolvability, broken links) reflect what was reachable at audit time and are excluded from the byte-for-byte determinism guarantee."
  ],
  "findings": [
    {
      "id": "F-001",
      "title": "No off-site identity surface found",
      "severity": "medium",
      "category": "offsite-corroboration-surface",
      "half": "discoverability",
      "evidence": "No sameAs, no footer/social profile links, and no Wikipedia/Wikidata link on any of the 5 sampled pages.",
      "evidence_detail": {},
      "mechanism": "The large majority of AI brand mentions are sourced from third-party pages; with zero off-site surface there is structurally little for an engine to cite.",
      "suggested_action": {
        "summary": "Establish and link off-site identity surfaces (social profiles, Crunchbase, Wikidata/Wikipedia) and mirror them in Organization.sameAs.",
        "priority": "medium",
        "mechanism": "The large majority of AI brand mentions are sourced from third-party pages; with zero off-site surface there is structurally little for an engine to cite.",
        "effort": "medium",
        "confidence": "low"
      }
    },
    {
      "id": "F-002",
      "title": "Missing landmarks, skip link, or a clear above-fold value proposition",
      "severity": "low",
      "category": "landmarks-skiplink-valueprop",
      "half": "engagement",
      "evidence": "no clear above-fold value prop (H1 + descriptive paragraph) on 3/5 pages. Heuristic; value-prop baked into a hero image is not detected.",
      "evidence_detail": {
        "no_main_pages": [],
        "no_skiplink_pages": [],
        "no_valueprop_pages": [
          "http://127.0.0.1:42695/",
          "http://127.0.0.1:42695/index.html",
          "http://127.0.0.1:42695/product-scarf.html"
        ]
      },
      "mechanism": "Landmarks and skip links aid keyboard/screen-reader navigation; a clear above-fold value prop tells arrivals they're in the right place, reducing bounce.",
      "suggested_action": {
        "summary": "Wrap primary content in <main>, add a skip-to-content link, and lead with an H1 plus a one-line description of what the page offers.",
        "priority": "low",
        "mechanism": "Landmarks and skip links aid keyboard/screen-reader navigation; a clear above-fold value prop tells arrivals they're in the right place, reducing bounce.",
        "effort": "low",
        "confidence": "low"
      }
    },
    {
      "id": "F-003",
      "title": "Non-sequential heading levels",
      "severity": "low",
      "category": "title-meta-heading-orientation",
      "half": "both",
      "evidence": "1/5 pages skip heading levels (e.g. http://127.0.0.1:42695/collections.html jumps h1->h3).",
      "evidence_detail": {
        "pages": [
          "http://127.0.0.1:42695/collections.html"
        ]
      },
      "mechanism": "Level jumps break the document outline machines build to locate a fact within a section.",
      "suggested_action": {
        "summary": "Keep headings sequential (no skipping levels) so the outline parses cleanly.",
        "priority": "low",
        "mechanism": "Level jumps break the document outline machines build to locate a fact within a section.",
        "effort": "low",
        "confidence": "medium"
      }
    }
  ]
}