{
  "site": "http://127.0.0.1:39255",
  "audited_at": "2026-01-01T00:00:00Z",
  "summary": {
    "total_findings": 1,
    "critical": 0,
    "high": 0,
    "medium": 1,
    "low": 0,
    "discoverability": 1,
    "engagement": 0
  },
  "scope": {
    "pages_sampled": 4,
    "pages_readable": 4,
    "urls": [
      "http://127.0.0.1:39255/index.html",
      "http://127.0.0.1:39255/about.html",
      "http://127.0.0.1:39255/features.html",
      "http://127.0.0.1:39255/pricing.html"
    ],
    "render_available": false,
    "robots_txt_found": true,
    "offline_replay": false,
    "skills_run": [
      "crawler-access",
      "machine-readability",
      "fact-extractability",
      "entity-trust",
      "onsite-engagement"
    ],
    "skill_errors": []
  },
  "limitations": [
    "Single-variant fetch: one geography, one device profile, no logged-in state, no cookie consent accepted. Personalization and geo/consent-gated content are not observed.",
    "Lab proxy, not field data: latency and Core Web Vitals appear as risk factors measured once, not real-user metrics.",
    "Network-dependent checks (sameAs resolvability, broken links) reflect what was reachable at audit time and are excluded from the byte-for-byte determinism guarantee."
  ],
  "findings": [
    {
      "id": "F-001",
      "title": "No off-site identity surface found",
      "severity": "medium",
      "category": "offsite-corroboration-surface",
      "half": "discoverability",
      "evidence": "No sameAs, no footer/social profile links, and no Wikipedia/Wikidata link on any of the 4 sampled pages.",
      "evidence_detail": {},
      "mechanism": "The large majority of AI brand mentions are sourced from third-party pages; with zero off-site surface there is structurally little for an engine to cite.",
      "suggested_action": {
        "summary": "Establish and link off-site identity surfaces (social profiles, Crunchbase, Wikidata/Wikipedia) and mirror them in Organization.sameAs.",
        "priority": "medium",
        "mechanism": "The large majority of AI brand mentions are sourced from third-party pages; with zero off-site surface there is structurally little for an engine to cite.",
        "effort": "medium",
        "confidence": "low"
      }
    }
  ]
}